{"canonicalDatasetId":"phase8-synthetic-preview-canonical-v1","datasetId":"phase8-synthetic-preview-v1","events":[{"category":{"state":"known","value":"preview"},"id":"preview:event:forest","name":{"state":"known","value":"架空イベント・森"},"stages":[{"encounters":[{"areaAttacks":[{"additionalTargetDamage":{"state":"known","value":450000},"additionalTargetMultiplier":{"state":"known","value":0.9},"attackKind":{"state":"known","value":"normal"},"firstTargetDamage":{"state":"known","value":600000},"firstTargetMultiplier":{"state":"known","value":1.2},"id":"preview:area:green:1","maxPerTurn":{"state":"known","value":1},"sourceEnemyId":{"state":"known","value":"preview:enemy:green"},"targetMode":{"state":"known","value":"all"}}],"enemies":[{"alignment":{"state":"known","value":"extreme"},"baseAttack":{"state":"known","value":500000},"critical":{"attackMultiplier":{"state":"unknown","value":null},"defenseIgnorePercent":{"state":"unknown","value":null},"enabled":{"state":"known","value":false},"rateRules":[]},"id":"preview:enemy:green","name":{"state":"known","value":"架空の緑敵"},"orderInEncounter":0,"passiveEffects":[{"appliesTo":"enemy-stats","bracket":"start-of-turn","cap":{"state":"known","value":60},"durationTurns":{"state":"unknown","value":null},"id":"preview:enemy:green:passive:turn","operation":"add-percent","target":"attack","trigger":{"end":{"state":"unknown","value":null},"hpMaxPercent":{"state":"unknown","value":null},"hpMinPercent":{"state":"unknown","value":null},"kind":"elapsed-turn","start":{"state":"known","value":1}},"value":{"state":"known","value":20}},{"appliesTo":"enemy-stats","bracket":"start-of-turn","cap":{"state":"unknown","value":null},"durationTurns":{"state":"unknown","value":null},"id":"preview:enemy:green:passive:hp","operation":"add-percent","target":"attack","trigger":{"end":{"state":"unknown","value":null},"hpMaxPercent":{"state":"known","value":50},"hpMinPercent":{"state":"known","value":0},"kind":"hp-range","start":{"state":"unknown","value":null}},"value":{"state":"known","value":40}}],"role":{"state":"known","value":"combat"},"superAttacks":[{"cooldownTurns":{"state":"unknown","value":null},"criticalOverride":{"state":"unknown","value":null},"derivedMultiplier":{"state":"known","value":2.5},"displayedDamage":{"state":"known","value":1250000},"effects":[{"appliesTo":"subsequent-normal-attacks","bracket":"post-super","cap":{"state":"unknown","value":null},"durationTurns":{"state":"known","value":1},"id":"preview:attack:green:1:effect:post-super","operation":"add-percent","target":"attack","trigger":{"end":{"state":"unknown","value":null},"hpMaxPercent":{"state":"unknown","value":null},"hpMinPercent":{"state":"unknown","value":null},"kind":"after-super","start":{"state":"unknown","value":null}},"value":{"state":"known","value":30}}],"id":"preview:attack:green:1","maxPerTurn":{"state":"unknown","value":null},"name":{"state":"known","value":"架空必殺A"},"probabilityPercent":{"state":"unknown","value":null},"slot":{"state":"unknown","value":null},"targetMode":{"state":"known","value":"single"},"usageRules":[]},{"cooldownTurns":{"state":"known","value":2},"criticalOverride":{"state":"unknown","value":null},"derivedMultiplier":{"state":"known","value":3.5},"displayedDamage":{"state":"known","value":1750000},"effects":[],"id":"preview:attack:green:2","maxPerTurn":{"state":"known","value":1},"name":{"state":"known","value":"架空必殺B"},"probabilityPercent":{"state":"known","value":25},"slot":{"state":"unknown","value":null},"targetMode":{"state":"known","value":"single"},"usageRules":[{"cooldownTurns":{"state":"known","value":2},"hpMaxPercent":{"state":"known","value":50},"hpMinPercent":{"state":"known","value":0},"maxPerTurn":{"state":"known","value":1},"order":1,"probabilityPercent":{"state":"known","value":25}}]}],"type":{"state":"known","value":"teq"}}],"id":"preview:event:forest:stage:1:encounter:1","order":1}],"id":"preview:event:forest:stage:1","name":{"state":"known","value":"架空ステージ1"}}]},{"category":{"state":"known","value":"preview"},"id":"preview:event:sky","name":{"state":"known","value":"架空イベント・空"},"stages":[{"encounters":[{"areaAttacks":[],"enemies":[{"alignment":{"state":"known","value":"super"},"baseAttack":{"state":"known","value":800000},"critical":{"attackMultiplier":{"state":"unknown","value":null},"defenseIgnorePercent":{"state":"unknown","value":null},"enabled":{"state":"known","value":false},"rateRules":[]},"id":"preview:enemy:blue","name":{"state":"known","value":"架空の青敵"},"orderInEncounter":0,"passiveEffects":[],"role":{"state":"known","value":"combat"},"superAttacks":[{"cooldownTurns":{"state":"unknown","value":null},"criticalOverride":{"state":"unknown","value":null},"derivedMultiplier":{"state":"known","value":2.5},"displayedDamage":{"state":"known","value":2000000},"effects":[],"id":"preview:attack:blue:1","maxPerTurn":{"state":"unknown","value":null},"name":{"state":"known","value":"架空必殺B"},"probabilityPercent":{"state":"unknown","value":null},"slot":{"state":"unknown","value":null},"targetMode":{"state":"known","value":"single"},"usageRules":[]}],"type":{"state":"known","value":"agl"}}],"id":"preview:event:sky:stage:1:encounter:1","order":1}],"id":"preview:event:sky:stage:1","name":{"state":"known","value":"架空ステージ2"}}]},{"category":{"state":"known","value":"preview"},"id":"preview:event:void","name":{"state":"known","value":"架空イベント・虚空"},"stages":[{"encounters":[{"areaAttacks":[],"enemies":[{"alignment":{"state":"known","value":"neutral"},"baseAttack":{"state":"known","value":1000000},"critical":{"attackMultiplier":{"state":"unknown","value":null},"defenseIgnorePercent":{"state":"unknown","value":null},"enabled":{"state":"known","value":false},"rateRules":[]},"id":"preview:enemy:neutral","name":{"state":"known","value":"架空の中立敵"},"orderInEncounter":0,"passiveEffects":[],"role":{"state":"known","value":"combat"},"superAttacks":[],"type":{"state":"known","value":"int"}}],"id":"preview:event:void:stage:1:encounter:1","order":1}],"id":"preview:event:void:stage:1","name":{"state":"known","value":"架空ステージ3"}}]}],"generatedAt":"2026-08-24T00:00:00.000Z","region":"synthetic","schemaVersion":"1.0.0"}